{
  "case_id": "py-ssti",
  "language": "python",
  "category": "injection",
  "severity": "HIGH",
  "owasp": [
    "A03:2025"
  ],
  "vulnerable": {
    "file": "vulnerable_variant.py",
    "line": 3
  },
  "benign_lookalike": {
    "file": "benign_lookalike.py"
  },
  "note": "User data rendered as a template."
}
