{
  "case_id": "js-xss",
  "language": "javascript",
  "category": "xss",
  "severity": "HIGH",
  "owasp": [
    "A03:2025"
  ],
  "vulnerable": {
    "file": "vulnerable_variant.js",
    "line": 2
  },
  "benign_lookalike": {
    "file": "benign_lookalike.js"
  },
  "note": "User data assigned to innerHTML."
}
