{
  "case_id": "py-yaml",
  "language": "python",
  "category": "deserialization",
  "severity": "HIGH",
  "owasp": [
    "A08:2025"
  ],
  "vulnerable": {
    "file": "vulnerable_variant.py",
    "line": 3
  },
  "benign_lookalike": {
    "file": "benign_lookalike.py"
  },
  "note": "yaml.load on untrusted input."
}
