{
  "case_id": "py-pathtraversal-04",
  "language": "python",
  "category": "injection",
  "severity": "HIGH",
  "owasp": [
    "A01:2025"
  ],
  "vulnerable": {
    "file": "vulnerable_variant.py",
    "line": 2
  },
  "benign_lookalike": {
    "file": "benign_lookalike.py"
  },
  "note": "pathtraversal variant 4 (python)."
}
