{
  "case_id": "cve-2025-68664-langchain-llm05",
  "language": "python",
  "category": "improper-output-handling",
  "severity": "HIGH",
  "owasp": [
    "CVE-2025-68664",
    "LLM05:2025"
  ],
  "vulnerable": {
    "file": "vulnerable_variant.py",
    "line": 2
  },
  "benign_lookalike": {
    "file": "benign_lookalike.py"
  },
  "note": "Regression anchor CVE-2025-68664 (LangChain): model output executed (improper output handling)."
}
