{
  "case_id": "ja-open-redirect-01",
  "language": "javascript",
  "category": "open-redirect",
  "severity": "LOW",
  "owasp": [
    "A01:2025"
  ],
  "vulnerable": {
    "file": "vulnerable_variant.js",
    "line": 1
  },
  "benign_lookalike": {
    "file": "benign_lookalike.js"
  },
  "note": "open-redirect variant 1 (javascript)."
}
