{
  "case_id": "hard-llm05-chained-exec",
  "language": "python",
  "category": "improper-output-handling",
  "severity": "HIGH",
  "owasp": [
    "LLM05:2025",
    "CWE-78"
  ],
  "vulnerable": {
    "file": "vulnerable_variant.py",
    "line": 8
  },
  "benign_lookalike": {
    "file": "benign_lookalike.py"
  },
  "note": "LLM05 chained across functions: model output stored in a dict, later run via subprocess(shell=True). Source is model output -> improper-output-handling (ai-llm sec.2), not plain cmdi. Benign constrains the model to an allowlisted argv action.",
  "difficulty": "hard"
}
