{
  "case_id": "ja-weakhash-03",
  "language": "javascript",
  "category": "crypto",
  "severity": "MEDIUM",
  "owasp": [
    "A02:2025"
  ],
  "vulnerable": {
    "file": "vulnerable_variant.js",
    "line": 2
  },
  "benign_lookalike": {
    "file": "benign_lookalike.js"
  },
  "note": "weakhash variant 3 (javascript)."
}
