{
  "case_id": "py-open-redirect-04",
  "language": "python",
  "category": "AuthN/AuthZ",
  "severity": "LOW",
  "owasp": [
    "A01:2025"
  ],
  "vulnerable": {
    "file": "vulnerable_variant.py",
    "line": 2
  },
  "benign_lookalike": {
    "file": "benign_lookalike.py"
  },
  "note": "open-redirect variant 4 (python)."
}
