{
  "case_id": "js-cors",
  "language": "javascript",
  "category": "config",
  "severity": "MEDIUM",
  "owasp": [
    "A05:2025"
  ],
  "vulnerable": {
    "file": "vulnerable_variant.js",
    "line": 2
  },
  "benign_lookalike": {
    "file": "benign_lookalike.js"
  },
  "note": "Reflected Origin with credentials."
}
