{
  "case_id": "ja-sqli-03",
  "language": "javascript",
  "category": "injection",
  "severity": "HIGH",
  "owasp": [
    "A03:2025"
  ],
  "vulnerable": {
    "file": "vulnerable_variant.js",
    "line": 1
  },
  "benign_lookalike": {
    "file": "benign_lookalike.js"
  },
  "note": "sqli variant 3 (javascript)."
}
