{
  "case_id": "go-pathtraversal-01",
  "language": "go",
  "category": "injection",
  "severity": "HIGH",
  "owasp": [
    "A01:2025"
  ],
  "vulnerable": {
    "file": "vulnerable_variant.go",
    "line": 4
  },
  "benign_lookalike": {
    "file": "benign_lookalike.go"
  },
  "note": "pathtraversal variant 1 (go)."
}
